id,taskName,startDate,endDate,duration,progress,assignee,parentId,predecessors,notes,source,isMilestone
1,Giai đoạn 1: Khảo sát & Thiết kế,2026-04-01,2026-04-10,10,100,Nguyễn Văn A,,,Khảo sát địa hình và lập bản vẽ kỹ thuật,,FALSE
2,Khảo sát địa chất,2026-04-01,2026-04-05,5,100,Trần Thị B,1,,Khoan thăm dò địa chất tại các trụ cầu,,FALSE
3,Thiết kế bản vẽ thi công,2026-04-06,2026-04-10,5,100,Lê Văn C,1,2,Hoàn thiện bản vẽ chi tiết,,FALSE
4,Phê duyệt thiết kế,2026-04-10,2026-04-10,0,100,Ban Quản lý,1,3,Mốc quan trọng: Thiết kế được phê duyệt,,TRUE
5,Giai đoạn 2: Thi công móng & Trụ,2026-04-11,2026-05-10,30,25,Phạm Văn D,,"4",Thi công các hạng mục dưới lòng đất,,FALSE
6,Ép cọc bê tông,2026-04-11,2026-04-20,10,80,Trần Thị B,5,"4SS",Sử dụng cọc ly tâm cường độ cao,,FALSE
7,Đổ bê tông móng trụ,2026-04-21,2026-05-10,20,0,Lê Văn C,5,"6FS,8FF",Cần kiểm soát nhiệt độ bê tông khối lớn,,FALSE
8,Hoàn thành phần móng,2026-05-10,2026-05-10,0,0,Ban Quản lý,5,7,Mốc quan trọng: Nghiệm thu phần móng,,TRUE
